{
  "$schema": "../schema/model.schema.json",
  "schemaVersion": 1,
  "id": "shards",
  "name": "Shards",
  "status": "design",
  "summary": "Single-sided bonding-curve market for a fixed 10,000-piece on-chain-art NFT collection; every swap pays a 1.00% native-ETH fee split 0.80% to collection holders, 0.10% to the builder and 0.10% to Programmable.",
  "documentation": "models/shards/README.md",
  "currentRelease": null,
  "releaseManifest": null,
  "specification": null,
  "deployment": null,
  "security": "models/shards/SECURITY.md",
  "network": {
    "name": "Ethereum",
    "chainId": 1
  },
  "contracts": [],
  "review": {
    "independentAudit": false,
    "publicContest": false
  },
  "releaseGates": [
    "Add a factory that deploys and wires the token, hook, NFT and renderer atomically, closing the window between deployment and initialise.",
    "Pass the complete lifecycle, including all three claim paths, against the pinned Ethereum Uniswap v4 deployment on a Mainnet fork.",
    "Complete stateful invariant coverage for backing, ETH custody, fee conservation and the permanent liquidity lock.",
    "Obtain independent review of the hook, the fee accumulator and the NFT inventory accounting.",
    "Publish the Ethereum deployment record, runtime code hashes and explorer source verification for every contract."
  ]
}
